{
  "case_id": "vmat_truebeam_canonical",
  "domain": "VMAT_IMRT",
  "expected_metrics_checksum": "26db8d24beb0a0e16cdfc15dc02b83b12deb87b484cff831e9b4b483e0dbf875",
  "formula_version": "geometry-v3",
  "generated_at": "2026-09-19T11:46:55Z",
  "mode": "VMAT_IMRT",
  "schema_version": 1,
  "source_checksum": "5097cd72e73a24e2d99b91d77c8e8df7a441ab299eb335ebeec41a8c5c156e91"
}
