{
  "case_id": "tomo_canonical",
  "domain": "TOMO",
  "expected_metrics_checksum": "dab7025de45a178ef7fe68595125adf3c5d986cf49f0594d0ed022bcc87acf1b",
  "formula_version": "tomo-v2",
  "generated_at": "2026-09-19T11:47:03Z",
  "mode": "TOMO",
  "schema_version": 1,
  "source_checksum": "c0804684e11fb3064a0980969d8e98a94e9f82266504aee92dd0cd73d9c6426b"
}
